idCommentaire,idPubli,auteur,contenu,dateCommentaire
1,44,21,Up hold read series young stuff together apply lawyer billion maybe war.,2024-04-30
2,54,82,End much far range until enter with.,2024-02-02
3,16,29,Part involve walk social raise network test cut hope call.,2024-01-01
4,50,2,Pattern help picture result show town order five.,2024-04-29
5,76,84,Research without page cold something law without successful from.,2024-01-22
6,80,55,Surface finish forget quickly young nor perform thus short majority.,2024-04-09
7,42,92,Buy man not fill occur kid too build drop put discover hotel either increase.,2024-04-25
8,79,48,Test right offer environmental direction talk car very.,2024-03-13
9,14,60,Next clear the traditional daughter character military blood blood Democrat left.,2024-02-05
10,57,95,Never friend record gas when anyone minute no hundred.,2024-02-17
11,20,46,Day stock although result inside forward issue interview baby detail nearly material popular.,2024-02-15
12,65,15,Table find especially face rock pick since.,2024-04-15
13,14,7,Nothing able painting wait big close address.,2024-05-05
14,51,50,Hand hundred better occur majority already charge wish development nothing reflect child crime.,2024-02-18
15,33,36,Service college total treat clearly teacher risk.,2024-02-13
16,100,41,Indeed far as do green beat never check president director out commercial.,2024-04-19
17,22,77,Have tough property recognize leave girl better music newspaper.,2024-01-19
18,42,42,Include condition field trial style computer individual man easy whatever provide.,2024-01-23
19,29,64,Family sister bag gun time forward special heart free grow knowledge affect fine smile herself house.,2024-05-03
20,62,30,Degree policy subject bring around art civil.,2024-04-03
21,66,94,Cold including student point specific skill fish.,2024-02-21
22,30,46,Allow nice security member finally draw become.,2024-04-28
23,78,55,Out office big involve machine quickly participant drop answer region affect black development street.,2024-04-11
24,80,74,Play project purpose administration level grow challenge determine.,2024-04-17
25,32,52,Company process late before happy mission there close woman.,2024-03-20
26,82,22,Those couple between place throw tax keep kind recently although room fly success everyone beyond.,2024-04-01
27,70,28,Happen sport event experience responsibility quite source Mr hot.,2024-01-14
28,52,28,Six attention since expert really ahead ground science pretty subject.,2024-01-31
29,49,85,Dream money enough group civil maintain hard very administration.,2024-01-02
30,63,67,Agreement marriage success young floor put report Republican store.,2024-02-26
31,4,9,Ago itself firm environmental east effort treatment fly forward daughter example.,2024-03-25
32,41,37,Deal wall itself much still animal though control a throughout clearly nothing mission shake very resource.,2024-05-01
33,3,56,Lot beat head leader memory matter matter wind three name.,2024-04-29
34,7,22,American miss good agent specific economy reveal political attention matter note.,2024-03-28
35,49,63,They example what fund Mrs American structure learn difficult this training have should star Republican.,2024-02-06
36,86,45,Among clearly too director arm stay left course.,2024-01-18
37,32,100,Apply skill former price seek out husband character state behavior early.,2024-04-05
38,28,100,Herself between wear born reason right street.,2024-01-27
39,82,75,Beautiful doctor media professor smile investment college station fall arm.,2024-03-18
40,9,87,Film subject model respond course all by cultural hour hotel guy must police store.,2024-03-23
41,77,37,Enjoy clearly production sit could my arrive choice right economy step feeling.,2024-01-15
42,67,95,Free study range green final like his ago network often detail.,2024-03-30
43,95,59,Wear allow Republican these another onto beautiful lay world entire.,2024-03-19
44,13,28,Win good structure movie in plan ahead hospital couple I that challenge office five.,2024-04-24
45,31,46,Work or condition door stay government every international.,2024-03-23
46,78,46,Attack we letter party maybe dog treat firm cover never.,2024-05-04
47,81,67,System drug people view anyone few just condition factor change see chance involve heavy house.,2024-04-09
48,87,75,Future PM page reveal only by process loss red.,2024-03-27
49,70,55,These travel officer team they avoid glass give player now crime either environmental address.,2024-02-19
50,12,93,Bag paper total form factor his happy simple sure car region tree concern hundred side.,2024-03-01
51,91,82,Avoid nearly report phone mention own clearly answer deal camera conference health page accept.,2024-02-10
52,29,13,Challenge yet safe image lawyer ball fact treat analysis quite give step become within voice want.,2024-01-17
53,56,90,Practice it strategy couple by others local here especially yet know you.,2024-01-05
54,91,12,Majority rise five tend field discuss here so hundred successful face support hold read.,2024-02-05
55,55,88,As follow common plant Mr course door yourself.,2024-01-25
56,84,58,Series country behind person since walk wait yourself perform line high.,2024-03-18
57,13,61,Hot authority administration treat protect history owner myself sister tree.,2024-03-12
58,5,34,By then under how bag nearly during law individual while plan themselves clearly these various.,2024-03-19
59,100,63,Service term yeah score career especially issue must style billion front food contain others quality.,2024-03-03
60,66,85,Time head possible half peace whole not people age live sort.,2024-02-22
61,45,31,Room leave coach image education evening across eye through Mr.,2024-04-04
62,79,47,Land crime space marriage suffer able similar challenge need before interesting middle party.,2024-02-25
63,74,31,Of audience may likely activity sure nearly today actually maintain.,2024-04-28
64,48,86,Business think control rich really model full fire.,2024-02-19
65,70,42,Customer that leave relate a find form often able difference recent.,2024-03-04
66,59,83,Day street population over kitchen large option far whether agreement.,2024-01-01
67,30,41,Game section scientist money democratic up word safe send first technology here special.,2024-02-25
68,50,42,Real town child real raise as loss door executive.,2024-04-24
69,7,83,Protect woman back way military computer word yes conference.,2024-03-03
70,2,60,Husband turn score election yourself give individual pick.,2024-01-16
71,39,39,Moment table each standard exist board win among perform my left officer over campaign.,2024-04-19
72,44,93,Environmental analysis bank without bag ever community likely catch.,2024-04-23
73,64,74,Way perhaps today speech treat both media determine national case she room culture hot best.,2024-01-06
74,54,80,Person standard win weight police when grow try management surface customer one the cell perform situation.,2024-05-06
75,92,31,Experience history present last debate organization event smile behavior move stuff past worry its.,2024-04-08
76,85,96,When choice opportunity blood month any degree.,2024-01-12
77,11,34,Response big produce those policy stock side perform tell back receive city.,2024-03-07
78,98,72,End source thus look you fast attorney save.,2024-03-26
79,25,9,Or middle sort laugh almost common check whole memory.,2024-02-08
80,43,93,Beautiful green office particularly however meeting officer strategy national arrive name benefit according able decide.,2024-03-08
81,68,28,This break win from test performance significant establish story again TV address.,2024-01-23
82,22,6,Fire best actually travel politics last method name successful half few nature find law identify.,2024-02-08
83,25,44,Everyone discussion painting though new bill provide cultural on.,2024-04-07
84,25,44,Test party long yes miss finish would appear safe.,2024-02-13
85,92,95,Age boy staff determine ever his finish positive decision perhaps entire.,2024-03-08
86,81,84,Start bag interesting term discussion best time teach analysis.,2024-03-04
87,60,16,Change with special natural set later condition account floor simply fire medical accept.,2024-01-26
88,11,11,It difficult hair wrong eye magazine serious share dinner field.,2024-02-28
89,64,19,We majority evening better customer air exactly land mouth street.,2024-02-12
90,77,53,Natural picture huge receive report guy environment hair.,2024-03-24
91,47,96,Nor agent weight themselves because just generation window campaign because.,2024-04-05
92,53,51,Soon shake summer consumer suffer work key stop.,2024-04-13
93,67,9,Of probably policy develop month well measure respond and son.,2024-01-28
94,87,67,Across play tell rise in after other treatment.,2024-02-03
95,35,53,Yourself care mind happen scientist meet never similar power part large arrive month example source.,2024-04-14
96,43,27,Either feeling dog paper take only best after new summer guess same.,2024-04-29
97,16,10,Government get nearly writer president wrong behavior most ask each seek.,2024-03-16
98,48,100,Loss people eight itself various will consumer respond resource onto common front some policy despite their.,2024-01-15
99,93,90,Decision military world upon morning international inside institution include.,2024-04-30
100,89,84,North conference attack can deep forget get road until nature go.,2024-04-02
