id,expéditeur,destinataire,contenu
1,37,15,Decision those religious alone.
2,66,52,Chance deal especially save general you teach.
3,84,34,Pretty run both material take.
4,96,21,Use already home bill general billion out.
5,29,11,Late start kid decide manager begin fast.
6,98,41,Reveal it body pull.
7,93,35,Act design sit blue.
8,48,94,Get science share so.
9,36,34,Enter free response.
10,59,51,House call do usually school.
11,34,10,Successful side sing dinner fast entire hundred.
12,1,68,Respond figure believe onto once home administration.
13,87,80,List bank painting many similar.
14,13,58,Certain detail across board administration financial while pattern.
15,88,4,Prevent himself person although.
16,29,21,My laugh her practice include.
17,12,6,Subject sound tree or officer generation yourself population.
18,71,8,Want think energy under everything use.
19,79,46,Simple bit move defense wind section walk.
20,99,18,Brother cost agreement never cup several according picture.
21,7,71,Clear speak compare choose.
22,15,57,Large necessary such house mind call.
23,46,29,Final ago plan mean.
24,48,82,Blue memory town interesting just good situation.
25,64,21,Four dark authority reduce voice collection.
26,21,34,Sense stay rather investment.
27,20,48,Teacher when nearly effort wrong actually case.
28,59,68,Happy area design issue.
29,11,100,Account million light business answer break.
30,60,23,Smile action find research buy argue.
31,48,44,Beat develop road.
32,22,3,Race within decade sea TV resource any.
33,11,95,Occur use woman teacher.
34,23,57,Live alone real data inside middle cell.
35,58,95,High interesting fast mouth.
36,10,39,Degree even partner glass world.
37,62,40,Possible thought when add cost decade voice.
38,56,66,Executive share beat tonight oil.
39,99,6,Director kitchen contain little.
40,51,64,Hope today hour set heart person look.
41,18,50,Artist try money condition.
42,79,97,Leg everyone data out.
43,98,83,The several necessary stop.
44,3,7,Through help hear attack.
45,41,33,Likely get return change notice.
46,79,51,And nor our art example.
47,37,53,Nor wife agreement month today.
48,32,94,Oil report understand pick wife indicate respond.
49,53,37,Short personal every feel.
50,44,38,Week great third threat save bank.
51,47,89,Anything dream clearly simple.
52,39,77,Everything both watch serious research assume.
53,25,74,Computer act religious better easy day.
54,48,76,Memory perhaps the important.
55,55,76,Successful second discuss usually threat.
56,60,88,Go have behind but certainly scientist.
57,13,63,Easy account begin two.
58,23,80,Blue stuff not budget would.
59,88,65,Point rich box foot.
60,51,45,Government purpose would letter take model off.
61,50,26,Suddenly according example these ability.
62,90,13,Brother military beautiful recently interesting Republican give.
63,67,74,Choose protect thousand through evening.
64,88,35,Loss network face will message short.
65,88,70,List window material career.
66,83,99,Between serve region rock response his sport picture.
67,32,55,Alone from more wish.
68,9,41,Reach factor see right vote might process present.
69,47,56,Cultural industry situation.
70,82,52,Available feel attack food.
71,63,25,Than security citizen seat each lawyer professor.
72,66,64,Hot imagine form job health.
73,83,53,Speech light become new.
74,31,82,Stand me conference police agency responsibility.
75,7,56,Country deal fact such me.
76,22,99,Product stage foot may resource thing laugh weight.
77,77,88,Surface try floor best.
78,31,69,Group security fact interview project hard price series.
79,100,98,Decision project practice personal face do.
80,70,85,More tough radio crime.
81,17,54,Price maintain about language move more religious.
82,88,26,Front try executive behavior media whole south.
83,44,41,New cause head.
84,77,46,Quickly action above.
85,95,34,New eight wait situation audience include media discussion.
86,40,70,About central be put however much side time.
87,21,81,Everything along quality test Mrs because.
88,27,65,Coach traditional measure property.
89,76,40,Start necessary man same interest them.
90,15,32,Church there purpose probably when somebody.
91,60,46,Practice leave arm air indicate benefit power factor.
92,82,62,Side whole marriage right style.
93,69,90,Type laugh green prepare just nature.
94,68,24,Call peace cell easy.
95,24,93,Kind consider say method approach.
96,6,88,Last bag year grow where.
97,75,90,Everyone product civil green gun.
98,50,20,Decide car ago brother use get.
99,67,43,Describe carry meeting school whole have myself.
100,14,95,From support hit response over American girl.
101,68,81,Method ago hotel tough.
102,97,83,Effort lay today visit network trip police.
103,69,68,Why their dinner catch.
104,1,80,Dinner suggest reason hear whole quality Republican.
105,70,4,Later by item difference finish.
106,3,19,Pull none war.
107,14,54,Hundred perform follow operation claim.
108,89,19,Affect house summer standard notice.
109,37,86,Majority no full move treatment leg.
110,63,37,Walk pretty become.
111,27,23,Hand over sell challenge simple little.
112,10,36,Such just attention strategy feeling.
113,81,31,Security federal range check could.
114,10,45,Marriage matter possible similar miss.
115,37,20,Suggest surface you service scene push political according.
116,61,37,Head quite piece claim despite especially.
117,59,97,Artist property although upon find something allow.
118,1,96,Through production success think reach central authority.
119,78,85,People agency five field brother it.
120,87,51,Election much support.
121,35,1,Kitchen think travel bit more here.
122,22,57,School he poor despite.
123,29,35,Address direction eight receive know south my.
124,49,45,Do imagine break general.
125,24,59,Low already country message over.
126,47,52,Those responsibility such defense some.
127,33,30,Serious better daughter prove require husband.
128,20,10,Success father media war.
129,12,60,Low customer hour.
130,10,71,Career move stuff light stuff reflect people.
131,25,76,Mission company Republican interesting soldier knowledge weight.
132,46,7,Reduce treatment sound size term.
133,71,26,See general different during whom parent note.
134,78,97,People standard customer walk fear firm.
135,72,16,Low magazine sea better series hope design magazine.
136,78,12,Ground one moment and either operation organization.
137,11,65,Throughout live arrive arrive agent avoid president far.
138,45,62,Floor bank view.
139,83,3,Protect direction focus traditional five usually effort cause.
140,7,99,Couple walk arrive have growth street billion.
141,96,1,Nothing water note material none quality major.
142,34,52,Plant occur outside media raise other.
143,61,79,Different meet college table.
144,82,43,Subject expert yet save.
145,72,90,New box letter indicate.
146,72,34,Provide now interest learn care social concern.
147,66,68,Human get body spend.
148,21,35,Phone thank shake size.
149,29,23,Focus nice notice.
150,47,66,Something these firm manage staff.
